{
  "$schema": "./U0_WEB_NODE_COMPATIBILITY_MAP.schema.json",
  "schemaVersion": 2,
  "frozenAt": "2026-08-21",
  "scope": "Legacy web /api compatibility decisions for the unified Node service",
  "productionStateClaim": "design_only_not_deployed",
  "routeCount": 87,
  "deploymentRoles": {
    "commerceWriter": {
      "roleId": "commerce-node-postgres-writer-v1",
      "deploymentLabel": "43-commerce-node",
      "sourceId": "node-api-route-corpus",
      "writes": ["auth_sub_mapping", "trading_subject", "business_legal_consent", "commerce"],
      "identityJoinKey": "kai_sub_immutable",
      "contractDigest": "sha256:afc1d3d5a458d72d30ac68aea7fa719320f7b89086ee20aa71c4a24af10ff6b6"
    },
    "identityWriter": {
      "roleId": "identity-auth-node-postgres-writer-v1",
      "deploymentLabel": "18-identity-node",
      "sourceId": "external-identity-authority-contract",
      "writes": ["credential", "oidc_user", "identity_session"],
      "subjectKey": "kai_sub_immutable",
      "contractDigest": "sha256:535cf6554cdc3eb324ccbd4612ab5c56f29e12ec5aa5b402b4f5b726f84ee2df"
    },
    "legacyRuntime": {
      "roleId": "legacy-python-sqlite-query-only-v1",
      "deploymentLabel": "18-legacy-python",
      "sourceId": "legacy-python-production-audit",
      "writes": [],
      "reads": ["approved_audit_query_only"],
      "contractDigest": "sha256:91fda94f50c49a3b979872914394c18db73be234a9e1d8dda779908074547ebd"
    }
  },
  "sources": [
    {"id":"legacy-python-production-audit","role":"legacy_dispatch","locator":"/tmp/cloudpay18-audit.BKba9P/server.py","selection":"exact_file","hashMode":"sha256_file_bytes","sha256Digest":"sha256:197abbfa0941ccc591104e3cdc0e6fef8c709f5dce55ced4556139cb5a1f5450","bytes":400445,"lineCount":6576,"fileCount":1,"observedAt":"2026-08-21T20:18:21+08:00","extractorVersion":"u0-python-dispatch-v1","normalizedEvidencePointer":"#/routes","normalizedCount":87,"normalizedDigest":"sha256:0a78b4f3992a6576b01de380dcab7700fbe7d58bf5b5b8ef6bc30eaa8338711a"},
    {"id":"legacy-web-production-audit","role":"legacy_web_callsites","locator":"/tmp/cloudpay18-audit.BKba9P/output-production.js","selection":"exact_file","hashMode":"sha256_file_bytes","sha256Digest":"sha256:1079aef9465b135933842698016488bed36ecc1e60708f23e57ddcb3d0d96de3","bytes":73055,"lineCount":1231,"fileCount":1,"observedAt":"2026-08-21T20:18:21+08:00","extractorVersion":"u0-web-api-prefix-v1","normalizedEvidencePointer":"#/webApiPrefixEvidence","normalizedCount":23,"normalizedDigest":"sha256:63e21a56705fc85643175c5aa3e0c5f589225705f5da5ed9a34551c6145c3e9d"},
    {"id":"node-api-route-corpus","role":"canonical_node_routes","locator":"backend/src","selection":"sorted_recursive_typescript_files","hashMode":"sorted_relative_path_sha256_bytes_lines_v1","sha256Digest":"sha256:89827f7cd4535006bca4359387fc5bed0f3c435d3c36bc375cfa854d9e31c657","bytes":1853041,"lineCount":30494,"fileCount":168,"observedAt":"2026-08-21T20:18:21+08:00","extractorVersion":"u0-node-target-evidence-v1","normalizedEvidencePointer":"#/routes/*/nodeRoutes","normalizedCount":71,"normalizedDigest":"sha256:7bb480b30ffb1c61891c1668c14516494242e2d5d976a0ca492454c5d7ac9a51"}
  ],
  "webApiPrefixEvidence": [
    {"prefix":"/api/access-requests","lineNumbers":[459,625]},
    {"prefix":"/api/access-requests/","lineNumbers":[521]},
    {"prefix":"/api/admin/access-requests","lineNumbers":[628]},
    {"prefix":"/api/admin/access-requests/","lineNumbers":[607]},
    {"prefix":"/api/agent/compute-requests","lineNumbers":[290]},
    {"prefix":"/api/assets","lineNumbers":[782]},
    {"prefix":"/api/auth/kai/start","lineNumbers":[885]},
    {"prefix":"/api/auth/login","lineNumbers":[961]},
    {"prefix":"/api/auth/logout","lineNumbers":[977]},
    {"prefix":"/api/auth/me","lineNumbers":[1192]},
    {"prefix":"/api/catalog","lineNumbers":[198]},
    {"prefix":"/api/config/readiness","lineNumbers":[1181]},
    {"prefix":"/api/disputes","lineNumbers":[738]},
    {"prefix":"/api/health","lineNumbers":[1181]},
    {"prefix":"/api/invoices","lineNumbers":[747]},
    {"prefix":"/api/orders","lineNumbers":[766,1070]},
    {"prefix":"/api/orders/","lineNumbers":[698,718,719,720,721]},
    {"prefix":"/api/payments/create","lineNumbers":[1083]},
    {"prefix":"/api/payments/mock-complete","lineNumbers":[1094]},
    {"prefix":"/api/payments/status","lineNumbers":[832]},
    {"prefix":"/api/refunds","lineNumbers":[733]},
    {"prefix":"/api/suppliers/applications","lineNumbers":[1148]},
    {"prefix":"/api/withdrawals","lineNumbers":[353,396]}
  ],
  "canonicalReadinessPolicy": {
    "mergeMode": "set_union_only",
    "compatibilityLayerMayRemoveBlockers": false,
    "u0ApprovalImpliesReleaseReady": false,
    "requiredAdditiveBlockers": [
      "ICP_FILING_NOT_APPROVED",
      "APP_FILING_NOT_APPROVED",
      "INTERNET_SERVICE_CLASSIFICATION_REQUIRED",
      "QIXIANG_CREDENTIAL_ROTATION_UNPROVEN",
      "QIXIANG_OLD_CREDENTIAL_REVOCATION_UNPROVEN",
      "QIXIANG_SERVICE_CONSTRUCTION_UNPROVEN",
      "QIXIANG_SCHEMA_0063_DEPLOYMENT_UNPROVEN",
      "QIXIANG_RUNTIME_INTEGRATION_PENDING",
      "QIXIANG_LOT_ACCOUNTING_UNPROVEN",
      "QIXIANG_EVIDENCE_DUAL_REVIEW_UNPROVEN",
      "QIXIANG_UNIQUE_CALLBACK_OWNER_UNPROVEN",
      "LEGACY_PAYMENT_PROVIDER_ID_RECONCILIATION_INCOMPLETE",
      "LEGACY_PAYMENT_TOPUP_ID_MAPPING_UNPROVEN",
      "LEGACY_DATA_RECONCILIATION_INCOMPLETE"
    ]
  },
  "routeBlockers": {
    "GET /api/payments/callback/qixiang": ["QIXIANG_CREDENTIAL_ROTATION_UNPROVEN","QIXIANG_OLD_CREDENTIAL_REVOCATION_UNPROVEN","QIXIANG_SERVICE_CONSTRUCTION_UNPROVEN","QIXIANG_SCHEMA_0063_DEPLOYMENT_UNPROVEN","QIXIANG_RUNTIME_INTEGRATION_PENDING","QIXIANG_LOT_ACCOUNTING_UNPROVEN","QIXIANG_EVIDENCE_DUAL_REVIEW_UNPROVEN","QIXIANG_UNIQUE_CALLBACK_OWNER_UNPROVEN","LEGACY_PAYMENT_PROVIDER_ID_RECONCILIATION_INCOMPLETE"],
    "GET /api/payments/status": ["LEGACY_PAYMENT_TOPUP_ID_MAPPING_UNPROVEN","LEGACY_PAYMENT_PROVIDER_ID_RECONCILIATION_INCOMPLETE"]
  },
  "statusDefinitions": {
    "reuse": "The canonical Node handler and contract are reused; only public routing changes.",
    "adapter": "A temporary Node-owned path or DTO adapter is required; it may never write legacy storage.",
    "migrate": "Legacy data or workflow semantics must be transformed into the canonical Node domain before traffic moves.",
    "quarantine": "The path is isolated from normal production traffic pending explicit evidence, drain, or replacement.",
    "retire": "The capability is obsolete or unsafe and must return 404 or 410 without fallback."
  },
  "globalProhibitions": [
    "dual_write",
    "legacy_sqlite_mutation_after_u2_freeze",
    "legacy_fallback_after_node_write",
    "secret_or_credential_copy",
    "synthetic_success_response",
    "provider_callback_replay_to_two_writers"
  ],
  "routes": [
    {"method":"GET","legacyPath":"/api/payments/callback/qixiang","auth":"provider_signature","io":"callback","payment":true,"webUsage":"provider_callback","nodeRoutes":["/mobile/v1/credits/topups/qixiang/notify"],"domain":"qixiang-topups","status":"quarantine","shadow":"forbidden","cutoverTarget":"node-api","forbidden":["legacy_write","dual_callback","secret_copy","credential_reuse","unreconciled_provider_mapping"]},
    {"method":"GET","legacyPath":"/api/payments/return/qixiang","auth":"public","io":"read","payment":true,"webUsage":"provider_return","nodeRoutes":["/payments/qixiang/return"],"domain":"qixiang-topups","status":"reuse","shadow":"allowed_sanitized","cutoverTarget":"node-api","forbidden":["status_inference","legacy_fallback"]},
    {"method":"GET","legacyPath":"/api/payments/status","auth":"web_session","io":"read","payment":true,"webUsage":"dynamic","nodeRoutes":["/mobile/v1/credits/topups/qixiang/:topupId"],"domain":"qixiang-topups","status":"migrate","shadow":"allowed_sanitized","cutoverTarget":"node-api","forbidden":["order_number_guessing","synthetic_status","legacy_fallback","unmapped_payment_read"]},
    {"method":"GET","legacyPath":"/api/health","auth":"public","io":"read","payment":false,"webUsage":"direct","nodeRoutes":["/mobile/v1/health"],"domain":"platform-readiness","status":"adapter","shadow":"allowed","cutoverTarget":"node-api","forbidden":["ready_fabrication","legacy_fallback"]},
    {"method":"GET","legacyPath":"/api/config/readiness","auth":"public","io":"read","payment":false,"webUsage":"direct","nodeRoutes":["/mobile/v1/readiness"],"domain":"platform-readiness","status":"adapter","shadow":"allowed","cutoverTarget":"node-api","forbidden":["capability_fabrication","legacy_fallback"]},
    {"method":"GET","legacyPath":"/api/market/status","auth":"public","io":"read","payment":false,"webUsage":"not_referenced","nodeRoutes":["/mobile/v1/readiness","/mobile/v1/market/listings"],"domain":"market","status":"adapter","shadow":"allowed","cutoverTarget":"node-api","forbidden":["inventory_fabrication","legacy_fallback"]},
    {"method":"GET","legacyPath":"/api/market/instruments","auth":"public","io":"read","payment":false,"webUsage":"not_referenced","nodeRoutes":[],"domain":"speculative-market","status":"retire","shadow":"forbidden","cutoverTarget":"none","forbidden":["expose","fallback"]},
    {"method":"GET","legacyPath":"/api/market/candles","auth":"public","io":"read","payment":false,"webUsage":"not_referenced","nodeRoutes":[],"domain":"speculative-market","status":"retire","shadow":"forbidden","cutoverTarget":"none","forbidden":["expose","synthetic_market_data","fallback"]},
    {"method":"GET","legacyPath":"/api/auth/kai/start","auth":"public","io":"read","payment":false,"webUsage":"direct_link","nodeRoutes":["/mobile/v1/auth/kai/start"],"domain":"identity","status":"reuse","shadow":"forbidden","cutoverTarget":"node-api_to_identity-authority","forbidden":["credential_capture","client_secret","mobile_redirect_fallback"]},